{
  "schema_version": 1,
  "track": "ks_silverstone-international",
  "notes": "Assembled by annotate.py from marks_ks_silverstone-international_20260907_145500.jsonl (2026-09-07). 5 corners, all with braking zones; corner 5 is compound with two apex gates (the compound flag was toggled mid-capture and resolved to true on assembly). Landmark ordering, apex-in-corner-speed-window containment, and gate non-overlap checked. BRAKING ZONES AND entry gates RE-DERIVED 2026-09-08 from the AI reference block 1_s2_pair1_adaptive_20260908_001510 (ks_audi_tt_cup, AI 100 pct): the drive-and-mark zones were anchored to a beginner's brake points, so corner 1 ended 12.6 m BEFORE the AI braked (no event detectable at all) and corner 3 opened 1.3 m after it (every lap clamped to the zone start -> biased-late point, fake near-zero sigma). Each braking zone now starts 60 m before the expert brake point and ends at turn-in (corner_speed.start); entry gates moved earlier where needed to keep the pass bracket open before its braking zone. PENDING Gate G0 on-track review.",
  "corners": [
    {
      "id": "1",
      "zones": {
        "braking": {
          "start": 0.057762353822,
          "end": 0.082217507064
        },
        "corner_speed": {
          "start": 0.082217507064342,
          "end": 0.11107648164034
        },
        "apex_gates": [
          0.099483758211136
        ],
        "apex_window_half_m": 20.0
      },
      "type": "fast",
      "compound": false,
      "entry_gate": 0.049273687145,
      "exit_gate": 0.11912588775158
    },
    {
      "id": "2",
      "zones": {
        "braking": {
          "start": 0.206145661514,
          "end": 0.251072913408
        },
        "corner_speed": {
          "start": 0.25107291340828,
          "end": 0.27213105559349
        },
        "apex_gates": [
          0.26479890942574
        ],
        "apex_window_half_m": 20.0
      },
      "type": "fast",
      "compound": false,
      "entry_gate": 0.197656994838,
      "exit_gate": 0.27810394763947
    },
    {
      "id": "3",
      "zones": {
        "braking": {
          "start": 0.316448276899,
          "end": 0.349544554949
        },
        "corner_speed": {
          "start": 0.34954455494881,
          "end": 0.3700005710125
        },
        "apex_gates": [
          0.36170065402985
        ],
        "apex_window_half_m": 20.0
      },
      "type": "medium",
      "compound": false,
      "entry_gate": 0.307959610222,
      "exit_gate": 0.37446880340576
    },
    {
      "id": "4",
      "zones": {
        "braking": {
          "start": 0.614872430745,
          "end": 0.651968359947
        },
        "corner_speed": {
          "start": 0.6519683599472,
          "end": 0.71553176641464
        },
        "apex_gates": [
          0.6938448548317
        ],
        "apex_window_half_m": 20.0
      },
      "type": "medium",
      "compound": false,
      "entry_gate": 0.595983624458,
      "exit_gate": 0.72784316539764
    },
    {
      "id": "5",
      "zones": {
        "braking": {
          "start": 0.786616276899,
          "end": 0.83181977272
        },
        "corner_speed": {
          "start": 0.83181977272034,
          "end": 0.8743531703949
        },
        "apex_gates": [
          0.84212869405746,
          0.86350798606873
        ],
        "apex_window_half_m": 20.0
      },
      "type": "slow",
      "compound": true,
      "entry_gate": 0.778127610222,
      "exit_gate": 0.88276708126068
    }
  ]
}
